<?xml version="1.0" encoding="UTF-8"?>
<knife_shop> xmlns:xsi="http://www.w3.org/2001/XMLSchema-instance" xmlns="$LOCAL_SCHEMA$"
            xsi:noNamespaceSchemaLocation="knifeShopSchemaDesign.xsd">


    <knife id="6">
        <name>Shadowmourne</name>
        <type>ax</type>
        <handy>two-handed</handy>
        <origin>Azeroth</origin>
        <visual_parameters>
            <length>55</length>
            <width>300</width>
            <material>steel</material>
            <handle>wood</handle>
            <bloodstream_presence>Yes</bloodstream_presence>
        </visual_parameters>
        <value>collectible</value>
    </knife>

    <knife id="4">
        <name>DaggerBlast</name>
        <type>dagger</type>
        <handy>one-handed</handy>
        <origin>Kazakhstan</origin>
        <visual_parameters>
            <length>20</length>
            <width>28</width>
            <material>bronze</material>
            <handle>plastic</handle>
            <bloodstream_presence>No</bloodstream_presence>
        </visual_parameters>
        <value>non-collectible</value>
    </knife>

    <knife id="71">
        <name>DickJohn</name>
        <type>dagger</type>
        <handy>one-handed</handy>
        <origin>America</origin>
        <visual_parameters>
            <length>60</length>
            <width>75</width>
            <material>gold</material>
            <handle>wood</handle>
            <bloodstream_presence>No</bloodstream_presence>
        </visual_parameters>
        <value>collectible</value>
    </knife>

    <knife id="2">
        <name>Tesak</name>
        <type>sword</type>
        <handy>one-handed</handy>
        <origin>Kazakhstan</origin>
        <visual_parameters>
            <length>20</length>
            <width>28</width>
            <material>steel</material>
            <handle>metal</handle>
            <bloodstream_presence>Yes</bloodstream_presence>
        </visual_parameters>
        <value>non-collectible</value>
    </knife>


</knife_shop>